{
  "schema_version": "1",
  "record_type": "support",
  "module_id": "portia",
  "class_id": "eng10_p2_2026",
  "work_id": "sup_p22_outcome_review_001",
  "support_id": "spt_p22_outcome_001",
  "status": "active",
  "target": {
    "kind": "support_process_participant",
    "record_ref": {
      "record_kind": "support_process_participant",
      "record_id": "spp_p22_outcome_student_001",
      "contract_version": "1"
    }
  },
  "need_refs": [
    {
      "record_kind": "support_need",
      "record_id": "spn_p22_outcome_001",
      "contract_version": "1"
    }
  ],
  "goal_refs": [
    {
      "record_kind": "support_goal",
      "record_id": "spg_p22_outcome_001",
      "contract_version": "1"
    }
  ],
  "strategy": {
    "kind": "environmental_or_instructional",
    "procedure": "At the start of independent work, make the designated quieter-work location available and remind the participant that the option may be selected; ordinary whole-class directions remain in effect."
  },
  "provider_plan": {
    "kind": "assigned",
    "participant_refs": [
      {
        "record_kind": "support_process_participant",
        "record_id": "spp_p22_outcome_teacher_001",
        "contract_version": "1"
      }
    ]
  },
  "schedule": {
    "kind": "recurring",
    "window": {
      "starts_on": "2026-09-02",
      "ends_on": "2026-09-11",
      "review_on": "2026-09-11"
    },
    "frequency": {
      "occurrences": 1,
      "interval_count": 1,
      "interval_unit": "day"
    },
    "selected_days": [
      "monday",
      "tuesday",
      "wednesday",
      "thursday",
      "friday"
    ],
    "timing_detail": "During scheduled independent-work periods."
  },
  "plan_state": "active",
  "creation_source": {
    "type": "digital_entry"
  },
  "created_at": "2026-09-01T15:10:00-04:00",
  "created_by": {
    "type": "local_operator",
    "display_label": "Synthetic Teacher"
  },
  "updated_at": "2026-09-01T15:10:00-04:00",
  "updated_by": {
    "type": "local_operator",
    "display_label": "Synthetic Teacher"
  }
}
